{
  "schemaVersion": "ContinuationState 0.2",
  "id": "delivery-pr-285",
  "workerId": "manager-gitops-chat",
  "status": "IN_PROGRESS",
  "branch": "work/operations/delivery-boundary-consolidation",
  "prNumber": 285,
  "dependsOn": [],
  "completed": [
    "integrate-pr-285"
  ],
  "remaining": [],
  "nextAction": null,
  "lastKnownGood": {
    "sha": "7023e898fa064bec773307bff5032f28c966f8b5",
    "checkpoint": "PR 285 merged into main with exact head readback"
  },
  "blockers": [],
  "handoffToWorkerId": null
}
