{
  "schemaVersion": "ContinuationState 0.2",
  "id": "r6e-hosted-begin-provider-injection",
  "workerId": "manager-gitops-chat",
  "status": "IN_PROGRESS",
  "branch": "work/operations/r6e-hosted-begin-provider-injection",
  "prNumber": 319,
  "dependsOn": [],
  "completed": [
    "characterize-hosted-begin-provider-gap",
    "inject-provider-at-hosted-begin-boundary",
    "add-work-observation-regression"
  ],
  "remaining": [
    "qualify-hosted-begin-provider-fix",
    "integrate-hosted-begin-provider-fix"
  ],
  "nextAction": "Open and exact-head qualify the R6e PR. Merge only if Agent Ops, Coordination Guard and Supervisor Snapshot pass, then re-run the same Work-bound V0.4 R6 black-box begin through github-connector-tools.",
  "lastKnownGood": {
    "sha": "a6ade3c221c863013ae3a18d9d2cdbb1a05db0d3",
    "checkpoint": "Live R6 canary exposed HOSTED_AGENT_WORK_AUTHORITY_UNKNOWN on Work-bound V0.4 begin. Root cause confirmed: hosted_agent_cycle._observe_work_ref constructed GitHubContinuationAuthority without provider after provider-boundary retirement. R6e now requires explicit provider for Work observation, forwards transport through begin_from_envelope, constructs GhApiTransport only at the explicit outer host, and adds missing-provider/injected-provider regressions."
  },
  "blockers": [],
  "handoffToWorkerId": null
}
