{
  "schemaVersion": "ContinuationState 0.2",
  "id": "r0-2-governed-delivery",
  "workerId": "manager-gitops-chat",
  "status": "IN_PROGRESS",
  "branch": "work/operations/paved-path-refactor-r0-2-ci-completeness-governed",
  "prNumber": 289,
  "dependsOn": [],
  "completed": [
    "materialize-governed-candidate",
    "validate-governed-candidate"
  ],
  "remaining": [
    "integrate-governed-candidate"
  ],
  "nextAction": "Integrate governed PR 289 after final main/head/CI precondition readback",
  "lastKnownGood": {
    "sha": "59e87e3d3e080ae38cfefc9e625624ea98e0c2d4",
    "checkpoint": "pr-289-exact-head-ci-green"
  },
  "blockers": [],
  "handoffToWorkerId": null
}
