{
  "schemaVersion": "ContinuationState 0.2",
  "id": "r6g-blocked-write-lease-terminal-reconciliation",
  "workerId": "manager-gitops-chat",
  "status": "DONE",
  "branch": "work/operations/r6g-blocked-write-lease-terminal-reconciliation",
  "prNumber": 321,
  "dependsOn": [],
  "completed": [
    "characterize-blocked-lease-close-gap",
    "reconcile-blocked-failure-as-terminal",
    "preserve-unknown-fail-closed",
    "add-close-regressions",
    "qualify-and-integrate-r6g"
  ],
  "remaining": [],
  "nextAction": null,
  "lastKnownGood": {
    "sha": "06bb6277596a735d0eac4c5b36af4c2eeec0e07a",
    "checkpoint": "PR #321 exact-head 0592f6d passed Agent Ops, Coordination Guard and Supervisor Snapshot; merged to main 06bb627"
  },
  "blockers": [],
  "handoffToWorkerId": null
}
