{
  "schemaVersion": "ContinuationState 0.2",
  "id": "r6-black-box-paved-path-canary",
  "workerId": "manager-gitops-chat",
  "status": "IN_PROGRESS",
  "branch": "work/operations/r6-black-box-live-canary",
  "prNumber": 328,
  "dependsOn": [
    "r5-delivery-finalization-composition"
  ],
  "completed": [
    "characterize-black-box-contract",
    "run-full-journey-canary",
    "run-black-box-failure-injection",
    "qualify-r6-promotion-gate"
  ],
  "remaining": [],
  "nextAction": null,
  "lastKnownGood": {
    "sha": "e5cfe0213330d61e937c1c9b507ef9b018ab0b92",
    "checkpoint": "R6 fresh black-box canary PASS after R6m: positive Hosted Agent Tool git.files.mutate request 5753209473 produced PASS result 5753218459 and branch head da9b6f9; negative main-target request 5753221464 was BLOCKED with AGENT_TOOL_TARGET_BRANCH_FORBIDDEN at 5753222635 with main unchanged and sentinel absent; PR #328 Coordination Guard real job PASS; governed Delivery r6-delivery-328-20260920 PASS merged main to e5cfe021."
  },
  "blockers": [],
  "handoffToWorkerId": null
}
