{
  "schemaVersion": "ContinuationState 0.2",
  "id": "m11-convergence-coverage-0-1",
  "workerId": "manager-gitops-primary",
  "status": "IN_PROGRESS",
  "branch": "work/operations/m11-convergence-coverage-0.1",
  "prNumber": 134,
  "dependsOn": [
    "m10-agent-cycle-close-0-1"
  ],
  "completed": [
    "define-convergence-inspection-contract",
    "implement-static-consumer-coverage",
    "compose-runtime-residue-evidence",
    "close-current-document-blind-spots",
    "integrate-convergence-ci-gate"
  ],
  "remaining": [
    "validate-and-integrate",
    "reconcile-cv1a-state"
  ],
  "nextAction": "validate-and-integrate",
  "lastKnownGood": {
    "sha": null,
    "checkpoint": null
  },
  "blockers": [],
  "handoffToWorkerId": null
}
