{
  "schemaVersion": "ContinuationState 0.2",
  "id": "engine-planning-salvage",
  "workerId": "manager-gitops",
  "status": "DONE",
  "branch": null,
  "prNumber": null,
  "dependsOn": [],
  "completed": [
    "Review planning/scope-and-documentation proposals for current Engine/Scene Core relevance without promoting preliminary proposals as current truth.",
    "Review archive/legacy-fixed-view-variants-2026-08-11 module-contract, rules-engine, measurement/calibration and prototype knowledge for concepts not yet represented in current Engine/Scene Core contracts.",
    "Route any surviving semantic candidates to an explicit Engine/Scene Core owner; classify the remainder as historical before cold archive."
  ],
  "remaining": [],
  "nextAction": null,
  "lastKnownGood": {
    "sha": "56ab8e396c39e400b1c29885b23130cf9b5aa491",
    "checkpoint": "ENGINE-SEMANTIC-DISPOSITION-PR110-MERGED"
  },
  "blockers": [],
  "handoffToWorkerId": null
}
