{
  "schemaVersion": "ContinuationState 0.2",
  "id": "r6i-concurrent-close-attribution",
  "workerId": "manager-gitops-chat",
  "status": "DONE",
  "branch": "work/operations/r6i-concurrent-close-attribution",
  "prNumber": 323,
  "dependsOn": [],
  "completed": [
    "characterize-concurrent-close-drift",
    "implement-noninterference-readback-evidence",
    "add-fail-closed-regressions",
    "qualify-and-integrate-r6i",
    "retry-r6-live-close"
  ],
  "remaining": [],
  "nextAction": null,
  "lastKnownGood": {
    "sha": "3e6adc6403b6712c57dbd6f31c8b39a042609eb9",
    "checkpoint": "PR #323 exact-head 24428b7 passed Agent Ops, Coordination Guard and Supervisor Snapshot; merged to main 3e6adc6. Post-merge live close retry is handled separately so Work reconciliation does not depend on that historical cycle outcome."
  },
  "blockers": [],
  "handoffToWorkerId": null
}
