{
  "schemaVersion": "ContinuationState 0.2",
  "id": "r0-2-close-evidence-recovery",
  "workerId": "manager-gitops-chat",
  "status": "IN_PROGRESS",
  "branch": "work/operations/r0-2-close-evidence-recovery-r4",
  "prNumber": null,
  "dependsOn": [],
  "completed": [
    "implement-close-evidence-recovery",
    "qualify-close-evidence-recovery",
    "integrate-close-evidence-recovery"
  ],
  "remaining": [
    "verify-r0-2-close-recovery"
  ],
  "nextAction": "Retry and verify the original R0.2 Agent Cycle close using the now-integrated exact compatibility recovery",
  "lastKnownGood": {
    "sha": "2f4be3756acc53d6f6ff00aa3b2db9730e844bad",
    "checkpoint": "main-close-recovery-integrated"
  },
  "blockers": [],
  "handoffToWorkerId": null
}
