{
  "schemaVersion": "ContinuationState 0.2",
  "id": "r6h-blocked-close-compatibility-recovery",
  "workerId": "manager-gitops-chat",
  "status": "DONE",
  "branch": "work/operations/r6h-blocked-close-compatibility-recovery",
  "prNumber": 322,
  "dependsOn": [],
  "completed": [
    "characterize-historical-close-signature",
    "admit-exact-observational-recovery-signature",
    "preserve-no-replay-and-unknown-fail-closed",
    "add-recovery-regressions",
    "qualify-and-integrate-r6h"
  ],
  "remaining": [],
  "nextAction": null,
  "lastKnownGood": {
    "sha": "2236ae3b09743b78c586e78730a9798d85c984e6",
    "checkpoint": "PR #322 exact-head 449f3cc passed Agent Ops, Coordination Guard and Supervisor Snapshot; merged to main 2236ae3"
  },
  "blockers": [],
  "handoffToWorkerId": null
}
