{
  "schemaVersion": "ContinuationState 0.2",
  "id": "delivery-pr-287",
  "workerId": "manager-gitops-chat",
  "status": "READY",
  "branch": "work/operations/paved-path-refactor-r0-1-ci-reentry",
  "prNumber": 287,
  "dependsOn": [],
  "completed": [],
  "remaining": [
    "integrate-pr-287"
  ],
  "nextAction": "Integrate PR 287 after Agent Cycle continuity handoff",
  "lastKnownGood": {
    "sha": null,
    "checkpoint": null
  },
  "blockers": [],
  "handoffToWorkerId": null
}
